250,Erik Nordström,2023-03-16 10:45:28-05,a51d21efbe3ec0a16c986d2e349c7a29e06b2b0c,Fix issue creating dimensional constraints,"During chunk creation, the chunk's dimensional CHECK constraints are created via an ""upcall"" to PL/pgSQL code. However, creating dimensional constraints in PL/pgSQL code sometimes fails, especially during high-concurrency inserts, because PL/pgSQL code scans metadata using a snapshot that might not see the same metadata as the C code. As a result, chunk creation sometimes fail during constraint creation.  To fix this issue, implement dimensional CHECK-constraint creation in C code. Other constraints (FK, PK, etc.) are still created via an upcall, but should probably also be rewritten in C. However, since these constraints don't depend on recently updated metadata, this is left to a future change.  Fixes #5456"
251,Konstantina Skovola,2023-02-13 05:02:51-06,72c0f5b25e569015aacb98cc1be3169a1720116d,Rewrite recompress_chunk in C for segmentwise processing,"This patch introduces a C-function to perform the recompression at a finer granularity instead of decompressing and subsequently compressing the entire chunk.  This improves performance for the following reasons: - it needs to sort less data at a time and - it avoids recreating the decompressed chunk and the heap inserts associated with that by decompressing each segment into a tuplesort instead.  If no segmentby is specified when enabling compression or if an index does not exist on the compressed chunk then the operation is performed as before, decompressing and subsequently compressing the entire chunk."
252,Nikhil Sontakke,2023-03-21 06:00:21-05,7e43f45ccb8b30800db5f19af6ab024d37efea2b,Ensure superuser perms during copy/move chunk,"There is a security loophole in current core Postgres, due to which it's possible for a non-superuser to gain superuser access by attaching dependencies like expression indexes, triggers, etc. before logical replication commences.  To avoid this, we now ensure that the chunk objects that get created for the subscription are done so as a superuser. This avoids malicious dependencies by regular users."
253,Fabrízio de Royes Mello,2023-03-17 15:47:34-05,38fcd1b76b14ddd73f64853a1bf6efca5e17fb4c,Improve Realtime Continuous Aggregate performance,"When calling the `cagg_watermark` function to get the watermark of a Continuous Aggregate we execute a `SELECT MAX(time_dimension)` query in the underlying materialization hypertable.  The problem is that a `SELECT MAX(time_dimention)` query can be expensive because it will scan all hypertable chunks increasing the planning time for a Realtime Continuous Aggregates.  Improved it by creating a new catalog table to serve as a cache table to store the current Continous Aggregate watermark in the following situations: - Create CAgg: store the minimum value of hypertable time dimension   data type; - Refresh CAgg: store the last value of the time dimension materialized   in the underlying materialization hypertable (or the minimum value of   materialization hypertable time dimension data type if there's no   data materialized); - Drop CAgg Chunks: the same as refresh cagg.  Closes #4699, #5307"
254,shhnwz,2022-12-22 23:37:51-06,699fcf48aa71189e581c27777715f89824b56268,Stats improvement for Uncompressed Chunks,During the compression autovacuum use to be disabled for uncompressed chunk and enable after decompression. This leads to postgres maintainence issue. Let's not disable autovacuum for uncompressed chunk anymore. Let postgres take care of the stats in its natural way.  Fixes #309
255,Alexander Kuzmenkov,2023-03-22 03:43:22-05,5c07a57a0246cf81eb55d5f563825cd20512c7cf,Simplify control flow in decompress_chunk_exec,"No functional changes, mostly just reshuffles the code to prepare for batch decompression.  Also removes unneeded repeated column value stores and ExecStoreTuple, to save 3-5"
257,Erik Nordström,2023-03-10 06:15:02-06,63b416b6b0065e6e178913a916a2f366f4f0d1a4,Use consistent snapshots when scanning metadata,"Invalidate the catalog snapshot in the scanner to ensure that any lookups into `pg_catalog` uses a snapshot that is consistent with the snapshot used to scan TimescaleDB metadata.  This fixes an issue where a chunk could be looked up without having a proper relid filled in, causing an assertion failure (`ASSERT_IS_VALID_CHUNK`). When a chunk is scanned and found (in `chunk_tuple_found()`), the Oid of the chunk table is filled in using `get_relname_relid()`, which could return InvalidOid due to use of a different snapshot when scanning `pg_class`. Calling `InvalidateCatalogSnapshot()` before starting the metadata scan in `Scanner` ensures the pg_catalog snapshot used is refreshed.  Due to the difficulty of reproducing this MVCC issue, no regression or isolation test is provided, but it is easy to hit this bug when doing highly concurrent COPY:s into a distributed hypertable."
258,Fabrízio de Royes Mello,2023-03-19 16:30:48-05,7d6cf90ee783656b8230e6ed8b35b47126729423,Add missing gitignore entry,Pull request #4827 introduced a new template SQL test file but missed to add the properly `.gitignore` entry to ignore generated test files.
259,Bharathy,2023-03-20 11:29:38-05,cc51e20e87f3ce9426b88790149cd7321cc4853e,Add support for ON CONFLICT DO UPDATE for compressed hypertables,This patch fixes execution of INSERT with ON CONFLICT DO UPDATE by removing error and allowing UPDATE do happen on the given compressed hypertable.
260,Konstantina Skovola,2023-03-14 07:23:09-05,8cccc375fbf3bd8e0025f596583d3f09db489e9d,Add license information to extension description,Fixes #5436
263,Mats Kindahl,2023-03-15 08:20:41-05,67ff84e8f2e380b8466152b8054ca4d30a17a3ed,Add check for malloc failure in libpq calls,"The functions `PQconndefaults` and `PQmakeEmptyPGresult` calls `malloc` and can return NULL if it fails to allocate memory for the defaults and the empty result. It is checked with an `Assert`, but this will be removed in production builds.  Replace the `Assert` with an checks to generate an error in production builds rather than trying to de-reference the pointer and cause a crash."
264,Zoltan Haindrich,2023-03-13 09:04:00-05,790b322b242351b151bfbd46706d42dc61e05595,Fix DEFAULT value handling in decompress_chunk,The sql function decompress_chunk did not filled in default values during its operation.  Fixes #5412
265,Alexander Kuzmenkov,2023-03-15 08:27:32-05,827684f3e2718c09e93914d60b88e79488374b33,Use prepared statements for parameterized data node scans,"This allows us to avoid replanning the inner query on each new loop, speeding up the joins."
266,Sven Klemm,2023-03-14 14:21:35-05,03a799b874a1a5d6accb40a2b49ed53a77b48e0a,Mention that new status values need handling in downgrade script,When adding new status values we must make sure to add special handling for these values to the downgrade script as previous versions will not know how to deal with those.
267,Dmitry Simonenko,2023-03-13 10:15:31-05,f8022eb33253dbe91bc643c317b787e03be37e1d,Add additional tests for compression with HA,Make sure inserts into compressed chunks work when a DN is down  Fix #5039
268,Sven Klemm,2023-01-29 14:53:50-06,65562f02e88e814b4823be40fd27bee245b130ae,Support unique constraints on compressed chunks,This patch allows unique constraints on compressed chunks. When trying to INSERT into compressed chunks with unique constraints any potentially conflicting compressed batches will be decompressed to let postgres do constraint checking on the INSERT. With this patch only INSERT ON CONFLICT DO NOTHING will be supported. For decompression only segment by information is considered to determine conflicting batches. This will be enhanced in a follow-up patch to also include orderby metadata to require decompressing less batches.
269,Sven Klemm,2023-02-05 12:23:14-06,c02cb76b38ee3ecbf33a8fe0d6a5864454ee2b67,Don't reindex relation during decompress_chunk,Reindexing a relation requires AccessExclusiveLock which prevents queries on that chunk. This patch changes decompress_chunk to update the index during decompression instead of reindexing. This patch does not change the required locks as there are locking adjustments needed in other places to make it safe to weaken that lock.
270,Sven Klemm,2023-03-12 15:12:59-05,20ea406616d557bb93de5c93710656bce0a5de8f,Add utility function to map attribute numbers,This patch adds a function ts_map_attno that can be used to map the attribute number from one relation to another by column name.
271,Jan Nidzwetzki,2023-03-10 07:34:56-06,356a20777c6f1aab234c5604f0f97de8077b4890,Handle user-defined FDW options properly,"This patch changes the way user-defined FDW options (e.g., startup costs, per-tuple costs) are handled. So far, these values were retrieved in apply_fdw_and_server_options() but reset to default values afterward."
272,Maheedhar PV,2023-03-12 18:48:18-05,5e0391392aca031c601f79e885452bb82ad909d1,Out of on_proc_exit slots on guc license change,"Problem:  When the guc timescaledb.license = 'timescale' is set in the conf file and a SIGHUP is sent to postgress process and a reload of the tsl module is triggered.  This reload happens in 2 phases 1. tsl_module_load is called which will load the module only if not already loaded and 2.The ts_module_init is called for every ts_license_guc_assign_hook irrespective of if it is new load.This ts_module_init initialization function also registers a on_proc_exit function to be called on exit.  The list of on_proc_exit methods are maintained in a fixed array on_proc_exit_list of size MAX_ON_EXITS (20) which gets filled up on repeated SIGHUPs and hence an error.  Fix:  The fix is to make the ts_module_init() register the on_proc_exit callback, only in case the module is reloaded and not in every init call.  Closes #5233"
273,Alexander Kuzmenkov,2023-03-09 04:34:28-06,e92d5ba748de9ba7f26221ebb9717c7db3fcca5d,Add more tests for compression,"Unit tests for different data sequences, and SQL test for float4."
274,Jan Nidzwetzki,2023-03-09 07:19:19-06,f5db023152afed21ac5ea413b5e5ae12185a23be,Track file trailer only in debug builds,The commit 96574a7 changes the handling of the file_trailer_received flag. It is now only used in asserts and not in any other kind of logic. This patch encapsulates the file_trailer_received in a USE_ASSERT_CHECKING macro.
275,Sven Klemm,2023-03-08 16:03:51-06,217ba014a7fc8e864a1dbd1b4af8634db67ed507,Use version checks to decide about RelationGetSmgr backporting,Use explicit version checks to decide whether to define backported RelationGetSmgr function or rely on the function being available. This simplifies the cmake code a bit and make the backporting similar to how we handle this for other functions.
276,Jan Nidzwetzki,2023-03-07 06:32:02-06,7b8177aa74de886b2e88a0fad41bc8ab9feb1e87,Fix file trailer handling in the COPY fetcher,"The copy fetcher fetches tuples in batches. When the last element in the batch is the file trailer, the trailer was not handled correctly. The existing logic did not perform a PQgetCopyData in that case. Therefore the state of the fetcher was not set to EOF and the copy operation was not correctly finished at this point.  Fixes: #5323"
277,Sven Klemm,2023-03-08 06:27:13-06,a854b2760f66cc640bf2fe71683b0e4595dfbdde,Simplify ts_indexing_relation_has_primary_or_unique_index,Rely on postgres functionality for index column tracking instead of rolling our own.
278,Bharathy,2023-03-08 06:46:29-06,f54dd7b05df420df1fd3318bd3f768305c619c20,Fix SEGMENTBY columns predicates to be pushed down,WHERE clause with SEGMENTBY column of type text/bytea non-equality operators are not pushed down to Seq Scan node of compressed chunk. This patch fixes this issue.  Fixes #5286
279,Erik Nordström,2023-02-24 05:38:16-06,c76a0cff688afe970d256c31862e63207d29b2ba,Add parallel support for partialize_agg(),"Make `partialize_agg()` support parallel query execution. To make this work, the finalize node need combine the individual partials from each parallel worker, but the final step that turns the resulting partial into the finished aggregate should not happen. Thus, in the case of distributed hypertables, each data node can run a parallel query to compute a partial, and the access node can later combine and finalize these partials into the final aggregate. Esssentially, there will be one combine step (minus final) on each data node, and then another one plus final on the access node.  To implement this, the finalize aggregate plan is simply modified to elide the final step, and to reserialize the partial. It is only possible to do this at the plan stage; if done at the path stage, the PostgreSQL planner will hit assertions that assume that the node has certain values (e.g., it doesn't expect combine Paths to skip the final step)."
280,Bharathy,2023-03-07 08:41:42-06,c13ed17fbce56129136239ad369ac5e5f1502821,Fix DELETE command tag,DELETE on hypertables always reports 0 as affected rows. This patch fixes this issue.
281,Sven Klemm,2023-03-07 04:29:52-06,f680b995299c2900a1883f4a94128b89d5b61db5,Fix assertion in calculate_chunk_interval for negative target size,When called with negative chunk_target_size_bytes calculate_chunk_interval will throw an assertion. This patch adds error handling for this condition. Found by sqlsmith.
282,Sven Klemm,2023-03-07 02:42:59-06,00321dba410dbfd3984c45401941d1f5989e05de,2.10.1 Post-release adjustments,Add 2.10.1 to update test scripts and adjust the downgrade versioning.
283,Konstantina Skovola,2023-02-10 02:21:47-06,5a3cacd06f95270569082cf14ba55b9092426c17,Fix sub-second intervals in hierarchical caggs,"Previously we used date_part(""epoch"", interval) and integer division internally to determine whether the top cagg's interval is a multiple of its parent's. This led to precision loss and wrong results in the case of intervals with sub-second components.  Fixed by using the `ts_interval_value_to_internal` function to convert intervals to appropriate integer representation for division.  Fixes #5277"
284,Fabrízio de Royes Mello,2023-03-06 12:51:03-06,00b566dfe478c11134bcf1e7bcf38943e7fafe8f,Remove unused functions,We don't use `ts_catalog_delete[_only]` functions anywhere and instead we rely on `ts_catalog_delete_tid[_only]` functions so removing it from our code base.
285,Sven Klemm,2023-03-03 01:44:49-06,d386aa1def48bb2a3321beffe3bb565548666765,Release 2.10.1,This release contains bug fixes since the 2.10.0 release. We recommend that you upgrade at the next available opportunity.  **Bugfixes** * #5159 Support Continuous Aggregates names in hypertable_(detailed_)size * #5226 Fix concurrent locking with chunk_data_node table * #5317 Fix some incorrect memory handling * #5336 Use NameData and namestrcpy for names * #5343 Set PortalContext when starting job * #5360 Fix uninitialized bucket_info variable * #5362 Make copy fetcher more async * #5364 Fix num_chunks inconsistency in hypertables view * #5367 Fix column name handling in old-style continuous aggregates * #5378 Fix multinode DML HA performance regression * #5384 Fix Hierarchical Continuous Aggregates chunk_interval_size  **Thanks** * @justinozavala for reporting an issue with PL/Python procedures in the background worker * @Medvecrab for discovering an issue with copying NameData when forming heap tuples. * @pushpeepkmonroe for discovering an issue in upgrading old-style   continuous aggregates with renamed columns * @pushpeepkmonroe for discovering an issue in upgrading old-style continuous aggregates with renamed columns
286,Sven Klemm,2023-03-04 03:18:34-06,5cd2c038796fb302190b080c90e5acddbef4b8d1,Simplify windows-build-and-test-ignored.yaml,Remove code not needed for the skip workflow of the windows test.
287,Sven Klemm,2023-03-04 02:06:28-06,8a2f1f916aeee0dabc0eb653f2483ba5e8d43f74,Fix windows package test,Chocolatey has all the postgres versions we need available so we can reenable previously disabled tests. But the recent packages seem to have different versioning schema without a suffix.
288,Dmitry Simonenko,2023-03-06 09:42:36-06,830c37b5b0d2ab920e12e288000a4cdb0f2d5896,Fix concurrent locking with chunk_data_node table,"Concurrent insert into dist hypertable after a data node marked as unavailable would produce 'tuple concurrently deleted` error.  The problem occurs because of missing tuple level locking during scan and concurrent delete from chunk_data_node table afterwards, which should be treated as `SELECT … FOR UPDATE` case instead.  Based on the fix by @erimatnor.  Fix #5153"
289,Ildar Musin,2023-03-02 10:13:18-06,4c0075010dbf57d6d300feda74bfa60cb76355ba,Add hooks for hypertable drops,To properly clean up the OSM catalog we need a way to reliably track hypertable deletion (including internal hypertables for CAGGS).
291,Fabrízio de Royes Mello,2023-03-02 13:09:49-06,32046832d3af53d2432bb1b2c7c9bdf5f88fcfb8,Fix Hierarchical CAgg chunk_interval_size,When a Continuous Aggregate is created the `chunk_interval_size` is defined my the `chunk_interval_size` of the original hypertable multiplied by a fixed factor of 10.  The problem is currently when we create a Hierarchical Continuous Aggregate the same factor is applied and it lead to an exponential `chunk_interval_size`.  Fixed it by just copying the `chunk_interval_size` from the base Continuous Aggregate for an Hierachical Continuous Aggreagate.  Fixes #5382
292,Nikhil Sontakke,2023-03-02 01:54:31-06,1423b55d1888b73c40d3d326fa63f8647fd8a413,Fix perf regression due to DML HA,"We added checks via #4846 to handle DML HA when replication factor is greater than 1 and a datanode is down. Since each insert can go to a different chunk with a different set of datanodes, we added checks on every insert to check if DNs are unavailable. This increased CPU consumption on the AN leading to a performance regression for RF > 1 code paths.  This patch fixes this regression. We now track if any DN is marked as unavailable at the start of the transaction and use that information to reduce unnecessary checks for each inserted row."
293,Mats Kindahl,2023-02-28 05:04:17-06,a6ff7ba6cc15b280a275e5acd315741ec9c86acc,Rename columns in old-style continuous aggregates,"For continuous aggregates with the old-style partial aggregates renaming columns that are not in the group-by clause will generate an error when upgrading to a later version. The reason is that it is implicitly assumed that the name of the column is the same as for the direct view. This holds true for new-style continous aggregates, but is not always true for old-style continuous aggregates. In particular, columns that are not part of the `GROUP BY` clause can have an internally generated name.  This commit fixes that by extracting the name of the column from the partial view and use that when renaming the partial view column and the materialized table column."
294,Sven Klemm,2023-03-03 04:22:06-06,e2e7ae304521b74ac6b3f157a207da047d44ab06,Don't run sanitizer test on individual PRs,Sanitizer tests take a long time to run so we don't want to run them on individual PRs but instead run them nightly and on commits to master.
295,Sven Klemm,2023-03-03 01:11:49-06,9574dd8e748486d9c365c199c94b4b535a7dd250,Adjust ARM64 package test,We only package timescaledb for ubuntu kinetic on PG14 because there are no prebuilt postgres packages available for the other postgres versions.
296,Pallavi Sontakke,2023-03-03 04:22:34-06,6be14423d5c51282d5c0d6f9c0b57a4e7123a4b7,Flag test space_constraint.sql.in for release run (#5380),"It was incorrectly flagged as requiring a debug build.  Disable-check: force-changelog-changed"
297,Erik Nordström,2023-02-24 11:25:45-06,386d31bc6e51913a02b0f0a0f964b36068bb9925,Make copy fetcher more async,"Make the copy fetcher more asynchronous by separating the sending of the request for data from the receiving of the response. By doing that, the async append node can send the request to each data node before it starts reading the first response. This can massively improve the performance because the response isn't returned until the remote node has finished executing the query and is ready to return the first tuple."
298,Sotiris Stamokostas,2023-03-02 01:54:55-06,750e69ede1a3161b5a650a7a0dfe1dd9cf1fe1b0,Renamed size_utils.sql,Renamed: tsl/test/sql/size_utils.sql tsl/test/expected/size_utils.out To: tsl/test/sql/size_utils_tsl.sql tsl/test/expected/size_utils_tsl.out because conflicting with test/sql/size_utils.sql
299,Jan Nidzwetzki,2023-02-23 13:23:32-06,7887576afaa113bc6e45f5007a6c6bca21b2108d,Handle MERGE command in reference join pushdown,"At the moment, the MERGE command is not supported on distributed hypertables. This patch ensures that the join pushdown code ignores the invocation by the MERGE command."
300,shhnwz,2023-02-26 10:48:02-06,e6f6eb3ab8c95b2531401324b97d345ec6fb8ff2,Fix for inconsistent num_chunks,Different num_chunks values reported by timescaledb_information.hypertables and timescaledb_information.chunks. View definition of hypertables was not filtering dropped and osm_chunks.  Fixes #5338
301,gayyappan,2022-10-28 15:32:43-05,2f7e0433a99d48455e65bcc7e6f63f547b243c7f,Create index fails if hypertable has foreign table chunk,We cannot create indexes on foreign tables. This PR modifies process_index_chunk to skip OSM chunks
302,Bharathy,2023-02-26 21:53:07-06,56ce7907d91ba8b5ec80ff2d79c32ceaaae65eaa,Backport MERGE command specific postgresql code,This patch backports following:  1. Refactor ExecInsert/Delete/Update    Backported commit 25e777cf8e547d7423d2e1e9da71f98b9414d59e 2. Backport all MERGE related interfaces and its implementations.    Backported commit 7103ebb7aae8ab8076b7e85f335ceb8fe799097c
309,Jan Nidzwetzki,2023-02-16 08:38:58-06,330bb8f4af761f3277b4b62269dca9c50e882bac,Added coccinelle rule to find strlcpy on NameData,NameData is a fixed-size type of 64 bytes. Using strlcpy to copy data into a NameData struct can cause problems because any data that follows the initial null-terminated string will also be part of the data.
311,Oleg Tselebrovskiy,2023-02-14 00:17:04-06,0746517c77d4412909776e009143fbaed5c71f0e,Fix some incorrect memory handling,"While running TimescaleDB under valgrind I've found two cases of incorrect memory handling.  Case 1: When creating timescaledb extension, during the insertion of metadata there is some junk in memory that is not zeroed before writing there. Changes in metadata.c fix this.  Case 2: When executing GRANT smth ON ALL TABLES IN SCHEMA some_schema and deconstructing this statement into granting to individual tables, process of copying names of those tables is wrong. Currently, you aren't copying the data itself, but an address to data on a page in some buffer. There's a problem - when the page in this buffer changes, copied address would lead to wrong data. Changes in process_utility.c fix this by allocating memory and then copying needed relname there.  Fixes #5311"
312,Jan Nidzwetzki,2023-02-20 02:23:41-06,7e43c702ba2663d56feba1043431d2232d8437c8,Increase timeout for PostgreSQL in upgrade tests,"The upgrade and downgrade tests are running PostgreSQL in Docker containers. The function 'wait_for_pg' is used to determine if PostgreSQL is ready to accept connections. In contrast to the upgrade tests, the downgrade tests use more relaxed timeout values. The upgrade tests sometimes fail because PostgreSQL cannot accept connections within the configured time range. This patch applies the more relaxed timeout values also to the upgrade script."
313,Mats Kindahl,2023-02-17 06:16:52-06,0cbd7407a66c84365f8969d1a197572a57325442,Get PortalContext when starting job,"When executing functions, SPI assumes that `TopTransactionContext` is used for atomic execution contexts and `PortalContext` is used for non-atomic contexts. Since jobs need to be able to commit and start transactions, they are executing in a non-atomic context hence `PortalContext` will be used, but `PortalContext` is not set when starting the job. This is not a problem for PL/PgSQL executor, but for other executors (such as PL/Python) it would be.  This commit fixes the issue by setting the `PortalContext` variable to the portal context created for the portal and restores it (to NULL) after execution.  Fixes #5326"
314,Jan Nidzwetzki,2023-02-17 09:24:45-06,83fc20f1954c5ff0d22f790cd8ee11309724445a,Change bgw_main field length to BGW_MAXLEN,"The content of bgw_main is copied into BackgroundWorker. bgw_function_name, which has a length of BGW_MAXLEN. This patch ensures that the size of these fields has the same length."
315,Maheedhar PV,2023-02-19 23:36:05-06,91b4a66eb9ae5feea57b94707b4a8e44b6505e9d,Release 2.10.0 (#5324),"This release contains new features and bug fixes since the 2.9.3 release.  This release is high priority for upgrade. We strongly recommend that you upgrade as soon as possible.  **Features** * #5241 Allow RETURNING clause when inserting into compressed chunks * #5245 Manage life-cycle of connections via memory contexts * #5246 Make connection establishment interruptible * #5253 Make data node command execution interruptible * #5243 Enable real-time aggregation for continuous aggregates with joins * #5262 Extend enabling compression on a continuous aggregrate with 'compress_segmentby' and 'compress_orderby' parameters  **Bugfixes** * #4926 Fix corruption when inserting into compressed chunks * #5218 Add role-level security to job error log * #5214 Fix use of prepared statement in async module * #5290 Compression can't be enabled on continuous aggregates when segmentby/orderby columns need quotation * #5239 Fix next_start calculation for fixed schedules"
316,Sven Klemm,2023-02-13 01:35:41-06,ce85546b5633ba2654fc3c26c658a9381e7ce73d,Fix ABI test,Pin the OpenSSL version we compile against to OpenSSL 1.1 in backwards ABI test because OpenSLL 3 is not available across all supported versions.
