546,Mats Kindahl,2022-10-20 06:37:26-05,84b2fef6ef166a5bad2b9d8fafcf0590259f8473,Fix GitHub output action,To avoid untrusted logged data to use `set-state` and `set-output` workflow commands without the intention of the workflow author GitHub have introduced a new set of environment files to manage state and output.  This commit changes the existing uses of `set-output` to use the new environment files instead.  See https://github.blog/changelog/2022-10-11-github-actions-deprecating-save-state-and-set-output-commands/
547,Erik Nordström,2022-09-01 10:26:41-05,4b05402580b9ae8e843acaf48f1559c7b261e032,Add health check function,"A new health check function _timescaledb_internal.health() returns the health and status of the database instance, including any configured data nodes (in case the instance is an access node).  Since the function returns also the health of the data nodes, it tries hard to avoid throwing errors. An error will fail the whole function and therefore not return any node statuses, although some of the nodes might be healthy.  The health check on the data nodes is a recursive (remote) call to the same function on those nodes. Unfortunately, the check will fail with an error if a connection cannot be established to a node (or an error occurs on the connection), which means the whole function call will fail. This will be addressed in a future change by returning the error in the function result instead."
548,Jan Nidzwetzki,2022-10-21 02:24:17-05,23c01c44e5c259cbc1091a1f3492758a27dcaad3,Remove an unused function in the copy code,Since e555eea9dbc05f4c09cf0d7e23b814054a459d19 the function TSCopyMultiInsertInfoIsEmpty is no longer used. This patch removes the unused code from src/copy.c.
549,Jan Nidzwetzki,2022-10-17 04:57:28-05,e555eea9dbc05f4c09cf0d7e23b814054a459d19,Fix performance regressions in the copy code,"In 8375b9aa536a619a5ac2644e0dae3c25880a4ead, a patch was added to handle chunks closes during an ongoing copy operation. However, this patch introduces a performance regression. All MultiInsertBuffers are deleted after they are flushed. In this PR, the performance regression is fixed. The most commonly used MultiInsertBuffers survive flushing.  The 51259b31c4c62b87228b059af0bbf28caa143eb3 commit changes the way the per-tuple context is used. Since this commit, more objects are stored in this context. The size of the context was used to set the tuple size to PG < 14. The extra objects in the context lead to wrong (very large) results and flushes almost after every tuple read.  The cache synchronization introduced in 296601b1d7aba7f23aea3d47c617e2d6df81de3e is reverted. With the current implementation, `MAX_PARTITION_BUFFERS` survive the flash. If `timescaledb.max_open_chunks_per_insert` is lower than `MAX_PARTITION_BUFFERS` , a buffer flush would be performed after each tuple read."
550,Erik Nordström,2022-10-15 09:20:34-05,40a6c4cf87edb3ca261cebcf4b2c6af11fcc6f0e,Fix unused sort in dimension partition lookup,"Dimension partition lookups use binary search to find the partition to place a chunk in. However, in the code, an array of partitions might not be sorted because the sort happened on a copy of the array instead of the main array. This change fixes the issue to ensure the array is sorted and binary search works properly."
551,Alexander Kuzmenkov,2022-10-18 12:12:35-05,f862212c8ca19b1af56c7608a68f22b7dd0c985e,Add clang-tidy warning readability-inconsistent-declaration-parameter-name,Mostly cosmetic stuff. Matched to definition automatically with --fix-notes.
553,Alexander Kuzmenkov,2022-10-18 11:53:38-05,05ba1cf22f0dc9232069b566dd23c3edb2cbaee4,Add clang-tidy warning readability-suspicious-call-argument,"Helps find accidentally swapped arguments, like in the recent epoll_ctl() error."
554,Mats Kindahl,2022-05-20 13:55:39-05,276d3a331dc4e248056424230ad953041866106d,Add macro to assert or error,"For some unexpected conditions, we have a check and an error that is generated. Since this always generate an error, it is more difficult to find the bug if the error is generated rather than an assert fired generating a core dump. Similarly, some asserts can occur in production builds and will lead to strange situations triggering a crash. For those cases we should instead generate an error.  This commit introduces a macro `Ensure` that will result in an assert in debug builds, but an error message in release build. This macro should only be used for conditions that should not occur during normal runtime, but which can happen is odd corner-cases in release builds and therefore warrants an error message.  It also replaces some existing checks with such errors to demonstrate usage."
555,Nikhil Sontakke,2022-10-04 05:25:54-05,f55aaf06dd2bf8d1d9296b19bb5f7eea541f05af,Add hook for ssl options,External components like timescaledb_cloudutils might want to add additional options or do additional ssl related processing. They can do so by implementing a hook and then assigning it to a timescaledb variable to allow timescale to invoke it as appropriate.
574,Markos Fountoulakis,2022-10-06 08:25:34-05,7600896a66e55fd933e81433f1aceecc7ddfc1c6,Fix libpq disconnect for PG15,Make sure the FATAL error message before the data node disconnects is not lost when using PG15.  https://github.com/postgres/postgres/commit/618c1670
556,Bharathy,2022-10-19 07:05:02-05,d218715d5c064c88f0e8d56070d762a95c3b65ab,Fix tests which fail on PG15,"When TimescaleDB 2.9.0 compiled against PG15, many tests fail due to permissions on default public schema not getting propagated to data nodes, although connected user has required GRANTS on access nodes. This patch fixes failing tests by explicitly granting required permissions for connected user or role after data nodes are added."
557,Alexander Kuzmenkov,2022-10-18 11:26:45-05,080011d767a6e61d09dc83b4d58f8be7dc9ecb31,Speed up the dist_copy tests,"In some cases we can use less chunks, less data, and not truncate tables."
558,Fabrízio de Royes Mello,2022-10-18 15:30:00-05,702ac53c0ac4fe339e87130622ddaaa63366f03f,Bump codecov github action version,Leftover from previous commit 8950ab where we bumped some github action versions to run on Node16 instead of Node12 (in deprecation).
559,Konstantina Skovola,2022-08-25 05:58:08-05,54ed0d5c05df990674a6fc9857e1120cdcc9b338,Introduce fixed schedules for background jobs,"Currently, the next start of a scheduled background job is calculated by adding the `schedule_interval` to its finish time. This does not allow scheduling jobs to execute at fixed times, as the next execution is ""shifted"" by the job duration.  This commit introduces the option to execute a job on a fixed schedule instead. Users are expected to provide an initial_start parameter on which subsequent job executions are aligned. The next start is calculated by computing the next time_bucket of the finish time with initial_start origin. An `initial_start` parameter is added to the compression, retention, reorder and continuous aggregate `add_policy` signatures. By passing that upon policy creation users indicate the policy will execute on a fixed schedule, or drifting schedule if `initial_start` is not provided. To allow users to pick a drifting schedule when registering a UDA, an additional parameter `fixed_schedule` is added to `add_job` to allow users to specify the old behavior by setting it to false.  Additionally, an optional TEXT parameter, `timezone`, is added to both add_job and add_policy signatures, to address the 1-hour shift in execution time caused by DST switches. As internally the next start of a fixed schedule job is calculated using time_bucket, the timezone parameter allows using timezone-aware buckets to calculate the next start."
560,Fabrízio de Royes Mello,2022-10-17 13:22:30-05,8950abe0ee071549fbcd2d52ce544532ef3e7844,Bump github action versions,All github actions that run on Node12 are deprecated so bumped github action versions to run on Node16.  https://github.blog/changelog/2022-09-22-github-actions-all-actions-will-begin-running-on-node16-instead-of-node12/
561,Fabrízio de Royes Mello,2022-10-13 18:05:04-05,043bd55c0bf7ef372da6ad3e7874be030b10781c,Miss segmentby compression option in CAGGs,"Timescale 2.7 released a new version of Continuous Aggregate (#4269) that store the final aggregation state instead of the byte array of the partial aggregate state, offering multiple opportunities of optimizations as well a more compact form.  This new version also removes the unecessary `chunk_id` column from the materialization hypertable and consequently the re-aggregation in the user view. It means the user view that query the materialization hypertable don't have a GROUP BY clause anymore that was problematic for query performance.  Before 2.7 when users turn compression ON we infer compression options `segmentby` and `orderby` based on the GROUP BY clause and time bucket respectively. With the new version without a GROUP BY clause in the user view the inferetion for the 'segmentby' compression option stopped to work.  Fixed it by changing the code to the compression on the new version of Continuous Aggregate (aka finals form) behave the same as the old version.  Fix #4816"
562,Alexander Kuzmenkov,2022-10-17 11:41:20-05,bde337e92d32e7d20f5c5e75fb0ccbc3e50e8262,Fix the flaky pg_dump test,It was frequently failing on Windows. Sort by what is actually printed.
563,Bharathy,2022-10-17 10:23:34-05,0e32656b54ca2221ea1a2da6b941e8055f13c7da,Support for PG15.,"As part of this patch, added and fixed some of the regress checks which fail on PG15."
564,Markos Fountoulakis,2022-10-17 08:06:15-05,d5c25e8914513694bb20dad22146c39c16d908a7,Adjust partition pruning to support PG15,PostgreSQL 15 introduced a Bitmapset for tracking non-pruned partitions for performance purposes. Adjust our code for expanding hypertable chunks to support this.  https://github.com/postgres/postgres/commit/475dbd0b718
565,Alexander Kuzmenkov,2022-10-13 12:25:11-05,066bcbed6d18a8c8a29a96b5ac607d9939ddc860,Rename row-by-row fetcher to COPY fetcher,"This name better reflects its characteristics, and I'm thinking about resurrecting the old row-by-row fetcher later, because it can be useful for parameterized queries."
566,Bharathy,2022-10-11 22:50:09-05,38878bee1671a0288c562e8a4e0934bb4b06143a,Fix segementation fault during INSERT into compressed hypertable.,"INSERT into compressed hypertable with number of open chunks greater than ts_guc_max_open_chunks_per_insert causes segementation fault. New row which needs to be inserted into compressed chunk has to be compressed. Memory required as part of compressing a row is allocated from RowCompressor::per_row_ctx memory context. Once row is compressed, ExecInsert() is called, where memory from same context is used to allocate and free it instead of using ""Executor State"". This causes a corruption in memory.  Fixes: #4778"
567,Sven Klemm,2022-10-10 17:05:10-05,8f5698f49d11d41dfe7b97c63e98b543e6d5de7a,Show information about OOM killer in CI,Include OOM kill event logs into error printout. Previously these would only be visible by inspecting the postgres log and looking for killed by signal 9.
568,Markos Fountoulakis,2022-10-11 05:43:02-05,e33bd89727cd058d09d353c2595965da613b97ae,Adjust TAP tests permissions,"Starting with PG15, default permissions on the public schema is restricted for any non-superuser non-owner. Adjust TAP tests so as to not fail with ""permission denied for schema public"".  https://git.postgresql.org/gitweb/?p=postgresql.git;a=commitdiff;h=b073c3cc"
569,Sven Klemm,2022-10-10 16:35:23-05,cc7ea8efd10ba5ade6cbf0e9af988ade06d24011,Fix ereport call in dist_copy for PG 12.0,ereport in PG 12.0 requires extra parenthesis around the auxiliary function calls.
571,Alexander Kuzmenkov,2022-10-10 06:20:44-05,fbe4d3c1df1d82dca4e21bd09292ddaa7d3368d8,Fix a warning with clang 14,Mark the variable as used for asserts only.
572,Alexander Kuzmenkov,2022-10-04 04:14:37-05,7758f5959c8ed64499ab0e6bb66c30464b11dd81,Update .clang-format for version 14,The only configuration we're missing is the newline for braces after case labels. The rest of the differences looks like bugs/omissions of the version 8 that we use now.  Require clang-format-14 in cmake and use it in the CI check. We can't support versions earlier than 14 because they have some formatting differences that can't be configured.
573,Alexander Kuzmenkov,2022-10-10 06:36:04-05,30596c0c478a168344a550b35ca480c5ad5a4a9f,Batch rows on access node for distributed COPY,"Group the incoming rows into batches on access node before COPYing to data nodes. This gives 2x-5x speedup on various COPY queries to distributed hypertables.  Also fix the text format passthrough, and prefer text transfer format for text input to be able to use this passthrough. It saves a lot of CPU on the access node."
576,Sven Klemm,2022-10-08 15:39:49-05,efbd8a94b2bcf54e0772dc533949555bd98eaeb7,Increase timeout to wait for cluster start,By default pg_isready only waits for 3 seconds before giving up which is occasionally not enough in the windows tests. This patch bumps the timeout up to 30 seconds which should be plenty to have the cluster start up under all circumstances.
577,Fabrízio de Royes Mello,2022-09-22 16:29:36-05,e0bbd4042acf1bdcfdcc4cac54c3c3e5bcbdd8e4,Fix missing upgrade/downgrade tests DDL validation,Recently we fixed a DDL error (#4739) after upgrading to 2.8.0 version that surprisly the CI upgrade/dowgrade tests didn't complained during the development of the feature (#4552).  Fixed it by adding an specific query in the `post.catalog.sql` script to make sure we'll check all the constraints of our internal tables and catalog.
578,Jan Nidzwetzki,2022-10-05 07:49:12-05,2f739bb3286bca4db6fda9e71ba6e74c7f22ecff,Post-release fixes for 2.8.1,Bumping the previous version and adding tests for 2.8.1.
580,Sven Klemm,2022-10-05 16:02:15-05,45a8c0b5cf60ba8dbbb1c0236a51b6afa96517be,Improve formatting when printing coredump information,Add a newline between query and stacktrace when printing coredump information to make copying the query easier.
582,Sven Klemm,2022-10-04 07:14:31-05,d2f0c4ed202fbf0b6cd3161197ad032fed70ace3,Fix update script handling of bgw_job_stat,"Update scripts should not use ADD/DROP/RENAME and always rebuild catalog tables to ensure the objects are identical between new install, upgrade and downgrade."
583,Fabrízio de Royes Mello,2022-10-04 12:20:23-05,a76f76f4ee6ee1d5437fe31cbd551e0d6f51393f,Improve size utils functions and views performance,Changed queries to use LATERAL join on size functions and views instead of CTEs and it eliminate a lot of unnecessary projections and give a chance for the planner to push-down predicates.  Closes #4775
584,Sven Klemm,2022-10-01 14:19:28-05,8cda0e17ec89452f1d536f8b1d66f939c891ea4e,Extend the now() optimization to also apply to CURRENT_TIMESTAMP,The optimization that constifies certain now() expressions before hypertable expansion did not apply to CURRENT_TIMESTAMP even though it is functionally similar to now(). This patch extends the optimization to CURRENT_TIMESTAMP.
585,Jan Nidzwetzki,2022-09-29 07:50:15-05,12b7b9f665865fde19c0a6460006147a3e545095,Release 2.8.1,"This release is a patch release. We recommend that you upgrade at the next available opportunity.  **Bugfixes** * #4454 Keep locks after reading job status * #4658 Fix error when querying a compressed hypertable with compress_segmentby on an enum column * #4671 Fix a possible error while flushing the COPY data * #4675 Fix bad TupleTableSlot drop * #4676 Fix a deadlock when decompressing chunks and performing SELECTs * #4685 Fix chunk exclusion for space partitions in SELECT FOR UPDATE queries * #4694 Change parameter names of cagg_migrate procedure * #4698 Do not use row-by-row fetcher for parameterized plans * #4711 Remove support for procedures as custom checks * #4712 Fix assertion failure in constify_now * #4713 Fix Continuous Aggregate migration policies * #4720 Fix chunk exclusion for prepared statements and dst changes * #4726 Fix gapfill function signature * #4737 Fix join on time column of compressed chunk * #4738 Fix error when waiting for remote COPY to finish * #4739 Fix continuous aggregate migrate check constraint * #4760 Fix segfault when INNER JOINing hypertables * #4767 Fix permission issues on index creation for CAggs  **Thanks** * @boxhock and @cocowalla for reporting a segfault when JOINing hypertables * @carobme for reporting constraint error during continuous aggregate migration * @choisnetm, @dustinsorensen, @jayadevanm and @joeyberkovitz for reporting a problem with JOINs on compressed hypertables * @daniel-k for reporting a background worker crash * @justinpryzby for reporting an error when compressing very wide tables * @maxtwardowski for reporting problems with chunk exclusion and space partitions * @yuezhihan for reporting GROUP BY error when having compress_segmentby on an enum column"
586,Alexander Kuzmenkov,2022-10-03 11:36:20-05,b259191dfe27bc13cb33dbc2bd327cf825ded400,Add COSTS OFF to make test more stable,For some reason the cost estimates are different on my machine.
587,Konstantina Skovola,2022-10-05 02:01:32-05,8a5e59b0978209d5913cdffcb6c5f69487ac1273,Fix flaky bgw_custom test,"The test was flaky because the scheduler was launching the scheduled jobs, therefore their next_start field could differ depending on whether they had finished executing. Fixed by not selecting the next_start field in alter_job calls, when it is not of interest.  Fixes #4719"
588,Jan Nidzwetzki,2022-10-04 09:57:04-05,33e4e554d4a18284bb2b1f79398aa9bb5ff0cc88,Ensure that internal users don't trigger workflows,"This patch adds a membership check to the 'Waiting for Engineering' workflow. The check ensures that the workflow is only triggered by external users. Without this check, when someone from the database engineering team responded to an issue, the ""need-more-info"" flag was removed and the issue was erroneously moved to the ""waiting for engineering"" column."
589,Bharathy,2022-10-04 09:50:23-05,f1c6fd97a3ca38aecae518efc2b2cda649dc745d,Continue compressing other chunks after an error,"When a compression_policy is executed by a background worker, the policy should continue to execute even if compressing or decompressing one of the chunks fails.  Fixes: #4610"
590,Dmitry Simonenko,2022-10-04 02:06:06-05,ea5038f26387c47b6dba538f521f99cea3430870,Add connection cache invalidation ignore logic,"Calling `ts_dist_cmd_invoke_on_data_nodes_using_search_path()` function without an active transaction allows connection invalidation event happen between applying `search_path` and the actual command execution, which leads to an error.  This change introduces a way to ignore connection cache invalidations using `remote_connection_cache_invalidation_ignore()` function.  This work is based on @nikkhils original fix and the problem research.  Fix #4022"
593,Sven Klemm,2022-10-01 08:06:55-05,7a6ce372e7727c43e0e077b31eb51ae75f6457f8,Adjust pgspot CI check,Change the pgspot check to use downgrade_to_version instead of update_from_version. We use downgrade_to_version instead of update_from_version because when the release PR for a new version has been merged to main but the version is not tagged yet update_from will not exist yet. In all other situations update_from_version and downgrade_to_version should point to the same version.
594,Rafia Sabih,2022-09-28 08:33:26-05,f7c769c684d1cafe0b73c405b109f035fde57c61,Allow manual index creation in CAggs,"The materialised hypertable resides in the _timescaledb.internal schema which resulted in permission error at the time of manual index creation by non super user. To solve this, it now switches to timescaledb user before index creation of CAgg.  Fixes #4735"
595,Konstantina Skovola,2022-09-06 08:25:09-05,9bd772de250308946b0d7ec6bb71f47ec1ee583a,Add interface for troubleshooting job failures,"This commit gives more visibility into job failures by making the information regarding a job runtime error available in an extension table (`job_errors`) that users can directly query. This commit also adds an infromational view on top of the table for convenience. To prevent the `job_errors` table from growing too large, a retention job is also set up with a default retention interval of 1 month. The retention job is registered with a custom check function that requires that a valid ""drop_after"" interval be provided in the config field of the job."
599,Ante Kresic,2022-09-26 07:53:01-05,cc110a33a2e785e8619f82a72ec48745c75208eb,Move ANALYZE after heap scan during compression,"Depending on the statistics target, running ANALYZE on a chunk before compression can cause a lot of random IO operations for chunks that are bigger than the number of pages ANALYZE needs to read. By moving that operation after the heap is loaded into memory for sorting, we increase the chance of hitting cache and reducing disk operations necessary to execute compression jobs."
600,Ante Kresic,2022-09-26 07:35:23-05,9c819882f317f5d3d53e0bd040c6e7eac2c4bee2,Increase memory usage for compression jobs,"When compressing larger chunks, compression sort tends to use temporary files since memory limits (`work_mem`) are usually pretty small to fit all the data into memory. On the other hand, using `maintenance_work_mem` makes more sense since its generally safer to use a larger value without impacting general resource usage."
601,Mats Kindahl,2022-06-17 06:10:46-05,c0e193dd810d11e66d75a987b7b1291e6fe7a9f9,Keep locks after reading job status,"When reading the job status table `bgw_job_stat` and after that updating it, locks where released after the read, allowing a competing session to update the job status and trigger a concurrent update error either in a session doing the update or in the scheduler. Since the scheduler does not recover after aborting with an error, this caused the background worker subsystem to stop and not start new jobs.  This commit fixes this by upgrading `RowExclusiveLock` to `ShareRowExclusiveLock` to ensure that not two sessions tries to update the row at the same time, remove an initial speculative lock that are taken when a job status row can be added, and also keeps the lock until the end of the transaction to prevent other sessions to update. Since these updating transactions are short, it should not cause other threads to block long.  Fixes #4293"
602,Bharathy,2022-09-27 09:03:15-05,f6dd55a19161d7d64d224069adbe0ab48c10ea29,Hypertable FK reference to partitioned table,"Consider a hypertable which has a foreign key constraint on a referenced table, which is a parititioned table. In such case, foreign key constraint is duplicated for each of the partitioned table. When we insert into a hypertable, we end up checking the foreign key constraint multiple times, which obviously leads to foreign key constraint violation. Instead we only check foreign key constraint of the parent table of the partitioned table.  Fixes #4684"
603,Mats Kindahl,2022-09-26 09:05:46-05,244b3e637c2a290a0dfc3262339ce1b190f63c08,Move perltidyrc to root,"To allow perltidy to be used from editors and IDEs, the perltidyrc file is moved from `scripts/perltidyrc` to `.perltidyrc`. This will allow editors and IDEs to quickly find the style file in the root of the repository, where `perltidy` normally searches for the style file.  The workflow is then updated to use the new location, and the two options `--backup-file-extension` and `--backup-and-modify-in-place` are moved to the workflow file to allow editors and IDEs to use whatever method they find useful to process the file."
604,Alexander Kuzmenkov,2022-09-21 08:10:25-05,6011c1446e9ddcd7f1c3ac22a3580be5523ea36b,Fix error when waiting for remote COPY to finish,"Pass proper flags to WaitLatchOrSocket, and fix the swapped up arguments."
605,Markos Fountoulakis,2022-09-20 07:15:47-05,9d0d159ac10ee7784754437ed0fa26f01de0cccf,Port perl tests to support PG15,Port the timescaledb perl tests and the corresponding infrastructure to support the new perl namespace introduced in PG15.  https://github.com/postgres/postgres/commit/b3b4d8e6
606,Fabrízio de Royes Mello,2022-09-15 14:37:06-05,893faf8a6b096f98a01435d36cf88f385a827b4c,Fix Continuous Aggregate migration policies,After migrate a Continuous Aggregate from the old format to the new using `cagg_migrate` procedure we end up with the following problems: * Refresh policy is not copied from the OLD to the NEW cagg; * Compression setting is not copied from the OLD to the NEW cagg.  Fixed it by properly copying the refresh policy and setting the `timescaledb.compress=true` flag to the new CAGG.  Fix #4710
607,Sven Klemm,2022-09-16 16:12:47-05,2529ae3f68504b6375b159f36c9c51a7d708d6e7,Fix chunk exclusion for prepared statements and dst changes,The constify code constifying TIMESTAMPTZ expressions when doing chunk exclusion did not account for daylight saving time switches leading to different calculation outcomes when timezone changes. This patch adds a 4 hour safety buffer to any such calculations.
608,Fabrízio de Royes Mello,2022-09-21 08:15:32-05,217f514657bcf008a9973b9fbffb6cd414b5d98d,Fix continuous aggregate migrate check constraint,Instances upgraded to 2.8.0 will end up with a wrong check constraint in catalog table `continuous_aggregate_migrate_plan_step`.  Fixed it by removing and adding the constraint with the correct checks.  Fix #4727
609,Jan Nidzwetzki,2022-09-22 06:29:52-05,4cb38350c67a2e60c8725934b402b53c812c22ee,Change project management GH action,"In af8e3c6b12035dd45bc7bf61e9420489cfa56eaa, an GitHub action to assign issues to a project column has been introduced. However, this action does not work with organization-wide projects. This patch replaces the used project management action with a more recent one."
