145,Zoltan Haindrich,2023-05-12 01:30:41-05,ab2cccb6e2b10008c2604af96be71ed8709ecb22,Post-release 2.11.0,Adjust the upgrade/downgrade scripts and add the tests.  (cherry picked from commit d5fea0a842cbd38d2d72db16e9e67f1c9b1ccf36)
239,Fabrízio de Royes Mello,2023-04-04 15:31:33-05,6440bb3477eef183459272cb90f6ffa8bf30b682,Remove unused function,Remove unused function `invalidation_threshold_htid_found`.
305,Maheedhar PV,2023-02-21 11:33:46-06,c8c50dad7eca4f7425bfb9980b872a1c44201ceb,Post-release fixes for 2.10.0,Bumping the previous version and adding tests for 2.10.0
308,Sven Klemm,2023-02-20 06:31:19-06,09766343997aa903f9d6a1ab14bcfc49a0045864,Set name for COPY insert buffer hash table,Having the hash table named makes debugging easier as the name is used for the MemoryContext used by the hash table.
379,Mats Kindahl,2023-01-16 02:24:32-06,8f4fa8e4cca73f11d3892ce6afde04ca104465d2,Add build matrix to Windows and Linux builds,"Build matrix is missing from the ignore workflows for the Windows and Linux builds, so this commit adds them."
429,Matvey Arye,2022-12-07 20:14:06-06,df16815009b6353383c720e364e1b3d2c82f8867,Fix memory leak for compression with merge chunks,The RelationInitIndexAccessInfo call leaks cache memory and seems to be unnecessary.
377,Jan Nidzwetzki,2023-01-17 01:46:21-06,19065bbdf39d2536a227041331adf24ffb38ffdc,Introduce a FDW option to mark reference tables,"With this patch, the ability to mark reference tables (tables that exist on all data nodes of a multi-node installation) via an FDW option has been added."
458,Fabrízio de Royes Mello,2022-11-22 14:35:00-06,35fa891013bcba87515b026e7e7b0abb728f1a54,Add missing gitignore entry,Pull request #4998 introduced a new template SQL test file but missed to add the properly `.gitignore` entry to ignore generated test files.
494,Markos Fountoulakis,2022-11-10 02:55:22-06,e2b7c76c9c1d53edf15ea3d4d01d666a675a7c5f,Disable MERGE when using hypertables,Fixes #4930  Co-authored-by: Lakshmi Narayanan Sreethar <lakshmi@timescale.com>
0,Lakshmi Narayanan Sreethar,2023-09-05 10:33:21-05,44e41c12ab25e36c202f58e068ced262eadc8d16,Fix segfault in set_integer_now_func,"When an invalid function oid is passed to set_integer_now_func, it finds out that the function oid is invalid but before throwing the error, it calls ReleaseSysCache on an invalid tuple causing a segfault. Fixed that by removing the invalid call to ReleaseSysCache.  Fixes #6037"
1,Bharathy,2023-09-01 22:54:31-05,e66a40038e3c84fb1a68da67ad71caf75c64a027,Fix server crash on UPDATE of compressed chunk,UPDATE query with system attributes in WHERE clause causes server to crash. This patch fixes this issue by checking for system attributes and handle cases only for segmentby attributes in fill_predicate_context().  Fixes #6024
304,noctarius aka Christoph Engelbert,2023-01-09 10:20:38-06,0118e6b9520a4c45363e2c92d4664a91dd77e786,Support CAGG names in hypertable_(detailed_)size,This small patch adds support for continuous aggregates to the `hypertable_detailed_size` (and with that `hypertable_size`). It adds an additional check to see if a continuous aggregate exists if a hypertable with the given regclass name isn't found.
597,Sven Klemm,2022-09-27 12:49:42-05,940187936c93b6d78e702ded75d79d914f8fea96,Fix segfault when INNER JOINing hypertables,This fixing a segfault when INNER JOINing 2 hypertables that are ordered by time.
495,Fabrízio de Royes Mello,2022-11-11 11:42:22-06,9e276c58ee7b99ae479f4a544de12bbbcc84c211,"Revert ""Upload test results into the database""",This reverts commit 252cefb509153fadcb32741a27ec3fa977487049 because it broke our CI globally.
464,Fabrízio de Royes Mello,2022-11-18 13:26:05-06,a5b8c9b084aa6edd5eb8aeb38cc0ab16ecfd8ac4,Fix caggs on caggs tests on PG15,PR #4668 introduced the Hierarchical Continuous Aggregates (aka Continuous Aggregate on top of another Continuous Aggregate) but unfortunately we miss to fix the regression tests on PG15.
683,Sven Klemm,2022-08-18 02:20:38-05,1f6d69720d1efd53ec42df5fca5e54a85898a5c6,Add link to forum to README,This also replaces appveyor badge with link to Windows GitHub actions.
740,Sven Klemm,2022-07-25 02:43:32-05,3ea06f4984b4141dba4209ad2d4e431f149a3f55,Remove ubuntu 21.10 (impish) from package tests,Ubuntu 21.10 is EOL and we no longer build packages for it.
306,Jan Nidzwetzki,2023-01-24 02:48:07-06,e0be9eaa281527ee1cc8569ce025cfe64dca8574,Allow pushdown of reference table joins,"This patch adds the functionality that is needed to perform distributed, parallel joins on reference tables on access nodes. This code allows the pushdown of a join if:   * (1) The setting ""ts_guc_enable_per_data_node_queries"" is enabled  * (2) The outer relation is a distributed hypertable  * (3) The inner relation is marked as a reference table  * (4) The join is a left join or an inner join"
307,Dmitry Simonenko,2023-02-21 11:17:20-06,f12a361ef7de9566113ea79617d49d62597b4bd2,Add timeout argument to the ping_data_node(),This PR introduces a timeout argument and a new logic to the timescale_internal.ping_data_node() function which allows to handle io timeouts for nodes being unresponsive.  Fix #5312
741,Sven Klemm,2022-07-25 02:47:01-05,661a6507edd0ec9c9c14b9317a6178aa4fd866b5,Fix coccinelle CI action,Switch coccinelle CI action to ubuntu 22.04 because 21.10 is EOL and stopped working.
575,Sven Klemm,2022-10-08 09:55:42-05,2defb2b0b374b150dc1e678c03f621fb2f59ecf8,Improve job_crash_log test,Older versions seens to have problems when undef is passed to poll_query_until so we change the call to pass explicit query instead.
2,Jan Nidzwetzki,2023-08-29 14:13:51-05,c6a930897e9f9e9878db031cc7fb6ea79d721a74,Use Debian Bookworm for 32-bit tests,"So far, we have used Debian Buster (10) for our 32-bit tests. This distribution is EOL in ~1 year and contains an old LLVM version (7.0). LLVM 7 contains a few bugs that break the JIT functionality of PostgreSQL (missing mixed-sign 64-bit operands on 32-bit architectures / failed to resolve name __mulodi4).  This patch changes the used Distribution for 32-bit tests to Debian Bookworm (12 / LLVM 14). Since the PostgreSQL download server no longer offers 32-bit Debian packages, PostgreSQL is built from source."
3,Lakshmi Narayanan Sreethar,2023-08-28 12:49:22-05,8e941b80ae1b0e0b6affe5431454cdc637628d99,Fix incorrect row count in EXPLAIN ANALYZE INSERT .. ON CONFLICT output,INSERT ... ON CONFLICT statements record few metrics in the ModifyTable node's instrument but they get overwritten by hypertable_modify_explain causing wrong output in EXPLAIN ANALYZE statments. Fix it by saving the metrics into HypertableModify node before replacing them.  Fixes #6014
901,Alexander Kuzmenkov,2022-04-21 08:56:05-05,a1e76d2e84a0b5c53bf8864f51c7cc365be2e231,Follow-up for compressed chunk collation #4236,Add a changelog message and add a check for broken chunks to the update script.
4,Lakshmi Narayanan Sreethar,2023-05-30 10:02:29-05,caada43454e25d3098744fa6b675ac7d07390550,PG16: Fix concurrent update issues with MERGE.,PG16 commit postgres/postgres@9321c79c fixes an issue with concurrent update issues in MERGE. This patch adapts that fix into the MERGE support for hypertables as well.  postgres/postgres@9321c79c
921,Sven Klemm,2022-04-11 14:46:57-05,bdaa4607d4fa2322e65f779a24f3fa42f47b5b52,Post release 2.6.1,Add 2.6.1 to update and downgrade tests.
786,Alexander Kuzmenkov,2022-06-21 02:56:09-05,5c69adfb7e0fcda27d89c1b98eee2f9f94639e5d,Add more tests for errors on data nodes,Use a data type with faulty send/recv functions to test various error handling paths.
5,Sven Klemm,2023-08-29 11:13:24-05,e4facda540286b0affba47ccc63959fefe2a7b26,Add compatibility layer for _timescaledb_internal functions,With timescaledb 2.12 all the functions present in _timescaledb_internal were moved into the _timescaledb_functions schema to improve schema security. This patch adds a compatibility layer so external callers of these internal functions will not break and allow for more flexibility when migrating.
859,Sven Klemm,2022-05-14 09:38:13-05,54f56af3efba2a3735a406ccb0211584055ee440,Support wildcards in IGNORES,Add support for wildcards in IGNORES for regression tests.
6,Jan Nidzwetzki,2023-08-31 02:56:38-05,77dc6ed42c6d0b65dd971566c2184e9bd7008e68,Fix non-deterministic cagg_insert isolation test,"One permutation of the cagg_insert isolation test contains an assumption about the execution order of three processes after a lock is released. However, this behavior is non-deterministic. This PR makes the assumption explicit and adds proper markers to the isolation test to make the output deterministic."
860,Sven Klemm,2022-05-17 07:00:07-05,a7c8641e04ca01d9e3a7973a7b3c817a430004dd,Bump postgres versions used in CI,"Bump postgres versions used in CI to 14.3, 13.7 and 12.11."
7,Jan Nidzwetzki,2023-08-29 07:47:57-05,08231c8aacd17152f315ad36d95c031fb46073aa,Export is_decompress_chunk_path / is_gapfill_path,This patch adds the 'ts_' prefix to the function names of is_decompress_chunk_path and is_gapfill_path and makes them available for use by other parts of TimescaleDB.
8,Jan Nidzwetzki,2023-08-30 16:49:34-05,fa04a067e0dce3a09b229cf2e6c127984cb9896f,Fix an invalid SPI result use after free,This PR fixes the invalid use of an SPI result after SPI_finish is called and the result is freed.
9,Sven Klemm,2023-08-30 02:15:34-05,e3437786ad7e3b5f152167ce0081e546178b8a12,Make multinode tests conditional,Since multinode tests take a long time to run we dont want to run them in CI on individual PRs but only on nightly runs.
1031,gayyappan,2022-01-20 12:23:12-06,9f64df8567abdbe6af11a9388acefb8237629ff5,Add ts_catalog subdirectory,Move files that are related to timescaledb catalog access to this subdirectory
10,Sven Klemm,2023-08-29 05:52:06-05,3b6dc7dc013572f91db181ccbbe4854f596714dd,Move partialize functions to _timescaledb_functions schema,"To increase schema security we do not want to mix our own internal objects with user objects. Since chunks are created in the _timescaledb_internal schema our internal functions should live in a different dedicated schema. This patch make the necessary adjustments for the following functions:  - finalize_agg_ffunc(internal,text,name,name,name[],bytea,anyelement) - finalize_agg_sfunc(internal,text,name,name,name[],bytea,anyelement) - partialize_agg(anyelement) - finalize_agg(text,name,name,name[][],bytea,anyelement)"
468,Fabrízio de Royes Mello,2022-11-16 13:34:53-06,b1742969d09114cd5138abe16f5c70dfbf864e4f,Add SQL test files to trailing whitespace CI check,In commit 1f807153 we added a CI check for trailing whitespaces over our source code files (.c and .h).  This commit add SQL test files (.sql and .sql.in) to this check.
11,Alexander Kuzmenkov,2023-08-29 05:39:17-05,623381ce99978b7f05f32ec1f5c117345ef6cd8e,Reread the catalog data after locking the chunk,"The compression status can change, and this is prevented by locking, so to keep our data consistent, we should reread the chunk metadata after we have locked it. Currently we have some code in place that masks this inconsistency by rereading the metadata in another place. This code is removed."
12,Sven Klemm,2023-08-29 03:49:47-05,a9751ccd5eb030026d7b975d22753f5964972389,Move partitioning functions to _timescaledb_functions schema,To increase schema security we do not want to mix our own internal objects with user objects. Since chunks are created in the _timescaledb_internal schema our internal functions should live in a different dedicated schema. This patch make the necessary adjustments for the following functions:  - get_partition_for_key(val anyelement) - get_partition_hash(val anyelement)
13,Sven Klemm,2023-08-28 16:26:23-05,b2a91494a11d8b82849b6f11f9ea6dc26ef8a8cb,Move ddl_internal functions to _timescaledb_functions schema,"To increase schema security we do not want to mix our own internal objects with user objects. Since chunks are created in the _timescaledb_internal schema our internal functions should live in a different dedicated schema. This patch make the necessary adjustments for the following functions:  - chunk_constraint_add_table_constraint(_timescaledb_catalog.chunk_constraint) - chunk_drop_replica(regclass,name) - chunk_index_clone(oid) - chunk_index_replace(oid,oid) - create_chunk_replica_table(regclass,name) - drop_stale_chunks(name,integer[]) - health() - hypertable_constraint_add_table_fk_constraint(name,name,name,integer) - process_ddl_event() - wait_subscription_sync(name,name,integer,numeric)"
14,Jan Nidzwetzki,2023-08-29 01:02:48-05,4516df285c962f801722019868fc0a982ed43a57,Make up/downgrade test deterministic,"Two queries in post.continuous_aggs.v3.sql had no ORDER BY specification. Therefore, the query output was not deterministic. This patch adds the missing ORDER BY."
15,Sven Klemm,2023-08-28 08:32:54-05,6576d969b319dac8e7fd08a9cf4cfc8197b34d1d,Move log invalidation functions to _timescaledb_functions schema,"To increase schema security we do not want to mix our own internal objects with user objects. Since chunks are created in the _timescaledb_internal schema our internal functions should live in a different dedicated schema. This patch make the necessary adjustments for the following functions:  - cagg_watermark(integer) - cagg_watermark_materialized(integer) - hypertable_invalidation_log_delete(integer) - invalidation_cagg_log_add_entry(integer,bigint,bigint) - invalidation_hyper_log_add_entry(integer,bigint,bigint) - invalidation_process_cagg_log(integer,integer,regtype,bigint,bigint,integer[],bigint[],bigint[]) - invalidation_process_cagg_log(integer,integer,regtype,bigint,bigint,integer[],bigint[],bigint[],text[]) - invalidation_process_hypertable_log(integer,integer,regtype,integer[],bigint[],bigint[]) - invalidation_process_hypertable_log(integer,integer,regtype,integer[],bigint[],bigint[],text[]) - materialization_invalidation_log_delete(integer)"
16,Sven Klemm,2023-08-28 01:38:26-05,28c7457faf9b909ea89b26b61cfa5a8428e2c23c,Move scheduler functions to _timescaledb_functions schema,"To increase schema security we do not want to mix our own internal objects with user objects. Since chunks are created in the _timescaledb_internal schema our internal functions should live in a different dedicated schema. This patch make the necessary adjustments for the following functions:  - restart_background_workers() - stop_background_workers() - start_background_workers() - alter_job_set_hypertable_id(integer,regclass)"
17,James Guthrie,2023-08-10 06:23:01-05,01e480d5d668f7fbfc81800d4aad6c5ee61ba227,Account for uncompressed rows in 'create_compressed_chunk',"`_timescaledb_internal.create_compressed_chunk` can be used to create a compressed chunk with existing compressed data. It did not account for the fact that the chunk can contain uncompressed data, in which case the chunk status must be set to partial.  Fixes #5946"
18,Fabrízio de Royes Mello,2023-08-27 06:20:04-05,a323547e691f7ca9ad5d0b3924071a51b0a365cd,Move cagg_migrate functions to _timescaledb_functions schema,"To increase schema security we do not want to mix our own internal objects with user objects. Since chunks are created in the _timescaledb_internal schema our internal functions should live in a different dedicated schema. This patch make the necessary adjustments for the following functions:  - cagg_migrate_create_plan(_timescaledb_catalog.continuous_agg,text,boolean,boolean) - cagg_migrate_execute_copy_data(_timescaledb_catalog.continuous_agg,_timescaledb_catalog.continuous_agg_migrate_plan_step) - cagg_migrate_execute_copy_policies(_timescaledb_catalog.continuous_agg,_timescaledb_catalog.continuous_agg_migrate_plan_step) - cagg_migrate_execute_create_new_cagg(_timescaledb_catalog.continuous_agg,_timescaledb_catalog.continuous_agg_migrate_plan_step) - cagg_migrate_execute_disable_policies(_timescaledb_catalog.continuous_agg,_timescaledb_catalog.continuous_agg_migrate_plan_step) - cagg_migrate_execute_drop_old_cagg(_timescaledb_catalog.continuous_agg,_timescaledb_catalog.continuous_agg_migrate_plan_step) - cagg_migrate_execute_enable_policies(_timescaledb_catalog.continuous_agg,_timescaledb_catalog.continuous_agg_migrate_plan_step) - cagg_migrate_execute_override_cagg(_timescaledb_catalog.continuous_agg,_timescaledb_catalog.continuous_agg_migrate_plan_step) - cagg_migrate_execute_plan(_timescaledb_catalog.continuous_agg) - cagg_migrate_execute_refresh_new_cagg(_timescaledb_catalog.continuous_agg,_timescaledb_catalog.continuous_agg_migrate_plan_step) - cagg_migrate_plan_exists(integer) - cagg_migrate_pre_validation(text,text,text)  Co-authored-by: Fabrízio de Royes Mello <fabriziomello@gmail.com Co-authored-by: Sven Klemm <sven@timescale.com>"
19,Sven Klemm,2023-08-27 06:20:04-05,e02b1f348eb4c48def00b7d5227238b4d9d41a4a,Simplify schema move update script,Use dynamic sql to create the ALTER FUNCTION statements for those functions that may not exist in previous versions.
20,Sven Klemm,2023-08-23 13:59:47-05,184e8398182fb3972137b4faaa64d3a08836dfd9,Move policy functions to _timescaledb_functions schema,"To increase schema security we do not want to mix our own internal objects with user objects. Since chunks are created in the _timescaledb_internal schema our internal functions should live in a different dedicated schema. This patch make the necessary adjustments for the following functions:  - policy_compression_check(jsonb) - policy_compression_execute(integer,integer,anyelement,integer,boolean,boolean) - policy_compression(integer,jsonb) - policy_job_error_retention_check(jsonb) - policy_job_error_retention(integer,jsonb) - policy_recompression(integer,jsonb) - policy_refresh_continuous_aggregate_check(jsonb) - policy_refresh_continuous_aggregate(integer,jsonb) - policy_reorder_check(jsonb) - policy_reorder(integer,jsonb) - policy_retention_check(jsonb) - policy_retention(integer,jsonb)"
21,Lakshmi Narayanan Sreethar,2023-07-05 13:19:07-05,6fb3c3f3f43fe70b7c5034ddfb11451df802890c,PG16: Handle updates to make_restrictinfo function,"While fixing a bug in filtering of ""cloned"" outer-join quals, PG16 adds 3 new parameters to the make_restrictinfo function. Updated the compat function to handle this change. This patch also cleans up the variants of make_restrictinfo from other versions to make it clear which args are passed.  postgres/postgres@991a3df227"
22,Lakshmi Narayanan Sreethar,2023-05-18 06:35:21-05,9425402264624f78fd052c700f53f7a736230007,PG16: Handle removed EquivalenceClass members,PG16 removes the outerjoin_delayed mechanism and RestrictInfo.nullable_relids.  postgres/postgres@b448f1c8 postgres/postgres@3bef56e1
23,Lakshmi Narayanan Sreethar,2023-08-24 09:41:44-05,3a493a47d1b5cc1a148c0040d531bf132f567e80,Remove unused functions,Removed the unused functions ts_make_pathkey_from_sortop and ts_make_pathkey_from_sortinfo.
24,Lakshmi Narayanan Sreethar,2023-05-13 01:50:42-05,040d45510430d13a9e1eda0ecb02981dfa1be39c,PG16: Datum macros are now inline functions,PG16 converted the *GetDatum() and DatumGet*() macros to inline functions. This doesn't affect most of our code but a few places like struct object initialisations cannot use inline functions. This commit updates all the places affected by this change.  postgres/postgres@c8b2ef05
491,Alexander Kuzmenkov,2022-11-09 10:01:58-06,0360812e3ccc627ab6e1cb6aab8e95f925956593,Simplify llvm configuration for linux/macos builds,Set it only in the matrixbuilder.
25,Sven Klemm,2023-08-22 07:15:13-05,0da18a93b5bd00c6b25ff3c485b2228d371b3326,Move chunk functions to _timescaledb_functions schema,"To increase schema security we do not want to mix our own internal objects with user objects. Since chunks are created in the _timescaledb_internal schema our internal functions should live in a different dedicated schema. This patch make the necessary adjustments for the following functions:  - calculate_chunk_interval(int, bigint, bigint) - chunk_status(regclass) - chunks_in(record, integer[]) - chunk_id_from_relid(oid) - show_chunk(regclass) - create_chunk(regclass, jsonb, name, name, regclass) - set_chunk_default_data_node(regclass, name) - get_chunk_relstats(regclass) - get_chunk_colstats(regclass) - create_chunk_table(regclass, jsonb, name, name) - freeze_chunk(regclass) - unfreeze_chunk(regclass) - drop_chunk(regclass) - attach_osm_table_chunk(regclass, regclass)"
26,Fabrízio de Royes Mello,2023-08-07 17:49:47-05,5bba74a2ec083728f8e93e09d03d102568fd72b5,Relax strong table lock when refreshing a CAGG,When refreshing a Continuous Aggregate we take a table lock on _timescaledb_catalog.continuous_aggs_invalidation_threshold when processing the invalidation logs (the first transaction of the refresh Continuous Aggregate procedure). It means that even two different Continuous Aggregates over two different hypertables will wait each other in the first phase of the refreshing procedure. Also it lead to problems when a pg_dump is running because it take an AccessShareLock on tables so Continuous Aggregate refresh execution will wait until the pg_dump finish.  Improved it by relaxing the strong table-level lock to a row-level lock so now the Continuous Aggregate refresh procedure can be executed in multiple sessions with less locks.  Fix #3554
27,Sven Klemm,2023-08-23 06:06:49-05,0f3d39574bf696e6627471ee16b5c26a12fb436c,Remove _timescaledb_internal.get_time_type,This function was used in an old version of a cagg informational view that was removed but the function itself was left in.
28,Alexander Kuzmenkov,2023-08-16 05:12:42-05,3373d43143ab8b17c49fdffd34fd35d551d33185,Don't look up entire Chunk struct for compressed chunks,It's not needed. Also add them to baserel cache.
29,Konstantina Skovola,2023-08-07 08:36:17-05,373c55662ca5f8a2993abf9b2aa7f5f4006b3229,Fix ordered append for partially compressed chunks,"In the exclusive presence of partially compressed chunks, this optimization was not applied because no pathkeys were supplied. Additionally, this patch makes sure that if applicable, the `enable_decompression_sorted_merge` optimization is chosen for the path, since it is more beneficial due to the ability to push down the sort below DecompressChunk."
30,Erik Nordström,2023-08-23 03:18:48-05,d1246ee2f30c171491c3f5b9efe0626314c37c13,Exclude PRs from bugs project board,"An `issue_comment` event is triggered by comments on both issues and PRs. However, the bugs project workflow did not filter out pull requests when the `issue_comment` event happened, so pull requests were also added to the bugs project board.  Add a conditional that filters out pull requests so that only issues are added to the board."
31,Sven Klemm,2023-08-23 02:07:14-05,e47832b51ac7b18e7441de3a1eeffe579057d8e2,Bump pgspot version to 0.6.0,pgspot 0.6.0 has a bugfix for function signature tracking to no longer consider default values as part of the function signature.
32,Sven Klemm,2023-08-22 05:01:19-05,cf04496e4b4237440274eb25e4e02472fc4e06fc,Move utility functions to _timescaledb_functions schema,To increase schema security we do not want to mix our own internal objects with user objects. Since chunks are created in the _timescaledb_internal schema our internal functions should live in a different dedicated schema. This patch make the necessary adjustments for the following functions:  - generate_uuid() - get_git_commit() - get_os_info() - tsl_loaded()
33,Sven Klemm,2023-08-22 02:37:40-05,183362e17baf71ae4f663709a9cb412a986aa4d8,Move size_util functions to _timescaledb_functions schema,"To increase schema security we do not want to mix our own internal objects with user objects. Since chunks are created in the _timescaledb_internal schema our internal functions should live in a different dedicated schema. This patch make the necessary adjustments for the following functions:  - relation_size(regclass) - data_node_hypertable_info(name, name, name) - data_node_chunk_info(name, name, name) - hypertable_local_size(name, name) - hypertable_remote_size(name, name) - chunks_local_size(name, name) - chunks_remote_size(name, name) - range_value_to_pretty(bigint, regtype) - get_approx_row_count(regclass) - data_node_compressed_chunk_stats(name, name, name) - compressed_chunk_local_stats(name, name) - compressed_chunk_remote_stats(name, name) - indexes_local_size(name, name) - data_node_index_size(name, name, name) - indexes_remote_size(name, name, name)"
34,Mats Kindahl,2023-08-21 10:35:19-05,3db692296028ea3c7407150a76aaa1feed6c5b4e,Call eq_func correctly in time_bucket_gapfill,"The equality comparison function is called using `DirectFunctionCall2Coll`, which do not set the `fcinfo->flinfo` when calling the PostgreSQL function.  Since `array_eq` uses `fcinfo->flinfo->fn_extra` for caching, and `flinfo` is null, this causes a crash.  Fix this issue by using `FunctionCall2Coll` instead, which sets `fcinfo->flinfo` before calling the PostgreSQL function.  Fixes #5981"
35,Sven Klemm,2023-08-21 11:55:35-05,4256009e4cfe3daebe199540ab8c32af34836e01,Move dist_internal functions to _timescaledb_functions schema,"To increase schema security we do not want to mix our own internal objects with user objects. Since chunks are created in the _timescaledb_internal schema our internal functions should live in a different dedicated schema. This patch make the necessary adjustments for the following functions:  - set_dist_id(uuid) - set_peer_dist_id(uuid) - validate_as_data_node() - show_connection_cache() - ping_data_node(name, interval) - remote_txn_heal_data_node(oid)"
36,Jan Nidzwetzki,2023-08-21 07:49:35-05,e99832727ac3f8aebd146015158490b28754ac1a,Place data in first/last function in correct mctx,"So far, the ts_bookend_deserializefunc() function has allocated the deserialized data in the current memory context. This data could be removed before the aggregation is finished. This patch moves the data into the aggregation memory context."
